{"schema_version":"villani.verifier_capability.v2","capability_id":"verifier_cap_001","verifier_name":"villani-verifier","verifier_version":"1","evidence_kinds":["test","patch"],"task_categories":[],"supports_acceptance_grade":true,"limits":{},"published_at":"2026-07-11T00:00:00Z","provenance_status":"recorded","attributes":{}}
